<data xmlns:xsi="http://www.w3.org/2001/XMLSchema-instance" xsi:noNamespaceSchemaLocation="../schemas/attack_types.xsd">
    <attackType id="basic_ranged" category="single" ammoConsumed="1">
        <prompt>Attack</prompt>
        <attackPhrase>@rangedAttack</attackPhrase>
        <hitChance>hit_chance_skill(context.parentItem.skill, null)</hitChance>
    </attackType>
    <attackType id="basic_melee" category="single" ammoConsumed="1">
        <prompt>Attack</prompt>
        <attackPhrase>@meleeAttack</attackPhrase>
        <hitChance>hit_chance_skill(context.parentItem.skill, "dodge")</hitChance>
    </attackType>
    <attackType id="targeted_ranged" category="targeted" ammoConsumed="1">
        <prompt>Targeted Attack</prompt>
        <attackPhrase>@rangedAttackLimb</attackPhrase>
        <hitChance>hit_chance_skill(context.parentItem.skill, null)</hitChance>
    </attackType>
    <attackType id="targeted_melee" category="targeted" ammoConsumed="1">
        <prompt>Targeted Attack</prompt>
        <attackPhrase>@meleeAttackLimb</attackPhrase>
        <hitChance>hit_chance_skill(context.parentItem.skill, "dodge")</hitChance>
    </attackType>
    <attackType id="spread_ranged" category="spread" ammoConsumed="1">
        <prompt>Spread Attack</prompt>
        <attackPhrase>@rangedAttack</attackPhrase>
        <hitChance>hit_chance_skill(context.parentItem.skill, null)</hitChance>
    </attackType>
    <attackType id="spread_melee" category="spread" ammoConsumed="1">
        <prompt>Spread Attack</prompt>
        <attackPhrase>@meleeAttack</attackPhrase>
        <hitChance>hit_chance_skill(context.parentItem.skill, "dodge")</hitChance>
    </attackType>
    <attackType id="autofire" category="single" ammoConsumed="3" rate="1" damageMult="2.0" hitChanceMult="-0.4">
        <prompt>Autofire</prompt>
        <attackPhrase>@rangedAutoAttack</attackPhrase>
        <hitChance>hit_chance_skill(context.parentItem.skill, null)</hitChance>
    </attackType>
    <attackType id="grenade" category="spread" ammoConsumed="0" weaponConsumeType="destroy">
        <prompt>Throw</prompt>
        <attackPhrase>@grenadeAttack</attackPhrase>
        <hitChanceOverall>hit_chance_skill(context.parentItem.skill, null)</hitChanceOverall>
    </attackType>
    <attackType id="punch" category="single" ammoConsumed="0" rate="2" damageType="physical" armorMult="1.0" isLoudOverride="false">
        <prompt>Punch</prompt>
        <attackPhrase>@punchAttack</attackPhrase>
        <damage>5</damage>
        <hitChance>hit_chance_skill("melee", "dodge")</hitChance>
        <range>NEAR</range>
    </attackType>
</data>